{
  "generatedAt": "2026-05-30T08:00:42.173Z",
  "todaySummary": "# Daily Executive Brief – Andy\n\n## Executive Summary\n- Focus on strengthening US GTM execution and improving efficiency.\n- Prepare thoroughly for Strategy Days in Stuttgart on May 26-27 with executive leadership.\n- Build AKEOS operational foundation while increasing strategic external visibility.\n\n## Top Priorities\n- Achieve GTM forecast target of 7.5 Million Euros.\n- Drive AI augmentation within GTM team led by RevOps (Pedro).\n- Develop stronger strategic communication and CEO/founder readiness.\n\n## Risks\n- Risk of overcommitment across multiple initiatives.\n- Potential loss of clarity due to operational overload and managing dual households.\n\n## Opportunities\n- Leverage AI-driven executive augmentation for competitive advantage.\n- Enhance industry visibility and build long-term board positioning.\n\n## Strategic Meetings\n- No strategic meetings scheduled for today.\n\n## People / Follow-ups\n- Collaborate closely with Patrick Glasser (CEO), Achim Hoth (CSO), Oli Kunath (CFO), and Dominik Kenzler (CPTO) on Strategy Days preparation.\n\n## Strategic Reminder\nBalance operational execution with long-term founder readiness to sustain growth and avoid overload.",
  "meetings": [
    {
      "time": "No strategic meetings scheduled for today.",
      "title": "No strategic meetings scheduled for today.",
      "badge": "Strategic",
      "prep": "Review context before meeting"
    }
  ],
  "priorityEmails": [],
  "followUps": [
    "Collaborate closely with Patrick Glasser (CEO), Achim Hoth (CSO), Oli Kunath (CFO), and Dominik Kenzler (CPTO) on Strategy Days preparation."
  ],
  "priorities": [
    {
      "title": "Achieve GTM forecast target of 7.5 Million Euros.",
      "status": "High"
    },
    {
      "title": "Drive AI augmentation within GTM team led by RevOps (Pedro).",
      "status": "High"
    },
    {
      "title": "Develop stronger strategic communication and CEO/founder readiness.",
      "status": "High"
    }
  ],
  "risks": [
    "Risk of overcommitment across multiple initiatives.",
    "Potential loss of clarity due to operational overload and managing dual households."
  ],
  "recommendedAction": ""
}